{
  "id": "romans-3-24-dikaioo-tree-0001",
  "claim_id": "romans-3-24-dikaioo-forensic",
  "claim_statement": "In Romans 3:24, the verb δικαιόω (\"dikaioumenoi\" / \"being justified\") is used primarily in a forensic, declarative sense (God's legal declaration of righteousness), rather than in a primarily transformative or intrinsic-renewal sense.",
  "status": "provisional",
  "resolution_summary": "Both Reformed and Catholic traditions agree that δικαιόω in Romans 3:24 is central to Paul's soteriology and involves God's gracious action toward sinners. However, they diverge fundamentally on whether the term primarily denotes a forensic/legal declaration (Reformed) or includes an intrinsic transformation of the believer (Catholic). This divergence stems from different hermeneutical priors regarding the relationship between forensic language and transformative reality, and how to harmonize Paul with James.",
  "source_debates": [
    "romans-3-24-dikaioo-debate-0001"
  ],
  "generated_from": {
    "author_model": "qwen/qwen3-max-thinking",
    "run_id": "2026-04-11-run-1",
    "commit_sha": "d153d93",
    "prompt_reference": "resolution_tree_synthesis_v1"
  },
  "root": {
    "node_id": "root-agreement-1",
    "node_type": "agreement",
    "summary": "Both traditions agree that Romans 3:24 describes God's gracious action toward sinners using the passive participle δικαιούμενοι, and that this action is central to Christian soteriology.",
    "status": "stable",
    "depends_on": {
      "type": "passage",
      "references": [
        "NA28-2012:Rom.3.24"
      ],
      "notes": "The Greek text δικαιούμενοι δωρεὰν τῇ αὐτοῦ χάριτι is the shared textual basis."
    },
    "divergence_point": {
      "kind": "lexical_decision",
      "label": "Semantic range of δικαιόω",
      "description": "Whether δικαιόω primarily denotes forensic declaration or includes intrinsic transformation as a necessary component.",
      "reference": "NA28-2012:Rom.3.24"
    },
    "blocking_prior": null,
    "supporting_evidence": [
      {
        "source_type": "scripture",
        "reference": "NA28-2012:Rom.3.24",
        "text_quoted": "dikaioumenoi dwrean th autou cariti dia thv apolutrwsewv thv en cristw ihsou",
        "original_language": "greek",
        "weight": "primary"
      }
    ],
    "counter_evidence": [],
    "profiles_in_scope": [
      "reformed-westminster",
      "catholic-tridentine"
    ],
    "children": [
      {
        "node_id": "reformed-forensic-branch",
        "node_type": "agreement",
        "summary": "Reformed tradition interprets δικαιόω as primarily forensic/legal declaration, consistent with Calvin's Institutes 3.11.2 and Westminster Confession 11.1, emphasizing imputation rather than infusion.",
        "status": "stable",
        "depends_on": {
          "type": "profile_axis",
          "references": [
            "authority_model:sola_scriptura",
            "interpretive_method:historical-grammatical",
            "clarity_hierarchy:Paul_reads_James"
          ],
          "notes": "Reformed interpretation prioritizes Paul's forensic language and treats James as addressing different aspects of faith."
        },
        "divergence_point": null,
        "blocking_prior": null,
        "supporting_evidence": [
          {
            "source_type": "historical",
            "reference": "Calvin-Inst-1559:3.11.2",
            "text_quoted": "A man is said to be justified in the sight of God when in the judgment of God he is deemed righteous, and is accepted on account of his righteousness. And this justification consists in the forgiveness of sins and the imputation of the righteousness of Christ.",
            "original_language": null,
            "weight": "primary"
          },
          {
            "source_type": "historical",
            "reference": "Westminster-1646:11.1",
            "text_quoted": "Those whom God effectually calleth, He also freely justifieth: not by infusing righteousness into them, but by imputing the righteousness of Christ unto them.",
            "original_language": null,
            "weight": "primary"
          },
          {
            "source_type": "scripture",
            "reference": "NA28-2012:2Cor.5.21",
            "text_quoted": "For our sake he made him to be sin who knew no sin, so that in him we might become the righteousness of God",
            "original_language": "greek",
            "weight": "secondary"
          },
          {
            "source_type": "scripture",
            "reference": "NA28-2012:Rom.3.22-23",
            "text_quoted": "There is no difference, for all have sinned and fall short of the glory of God",
            "original_language": "greek",
            "weight": "illustrative"
          }
        ],
        "counter_evidence": [
          {
            "source_type": "scripture",
            "reference": "NA28-2012:Jas.2.24",
            "text_quoted": "Ye see then how that by works a man is justified, and not by faith only",
            "original_language": "greek",
            "weight": "secondary"
          },
          {
            "source_type": "historical",
            "reference": "Trent-1547-S6:Ch.7",
            "text_quoted": "Justification itself, which is not remission of sins merely, but also the sanctification and renewal of the inward man",
            "original_language": null,
            "weight": "secondary"
          }
        ],
        "profiles_in_scope": [
          "reformed-westminster"
        ],
        "children": [],
        "notes": "Reformed position treats forensic declaration as logically prior to and distinct from sanctification, though not separable in practice."
      },
      {
        "node_id": "catholic-transformative-branch",
        "node_type": "agreement",
        "summary": "Catholic tradition interprets δικαιόω as including both forensic declaration and real transformation, following Trent Session 6 Chapter 7, which explicitly rejects justification as 'merely remission of sins' and affirms 'sanctification and renewal of the inward man'.",
        "status": "stable",
        "depends_on": {
          "type": "profile_axis",
          "references": [
            "authority_model:scripture_tradition_magisterium",
            "interpretive_method:canonical",
            "clarity_hierarchy:harmonization_required"
          ],
          "notes": "Catholic interpretation requires harmonizing Paul and James as complementary, not contradictory."
        },
        "divergence_point": null,
        "blocking_prior": null,
        "supporting_evidence": [
          {
            "source_type": "historical",
            "reference": "Trent-1547-S6:Ch.7",
            "text_quoted": "Justification itself, which is not remission of sins merely, but also the sanctification and renewal of the inward man, through the voluntary reception of the grace, and of the gifts, whereby man of unjust becomes just",
            "original_language": null,
            "weight": "primary"
          },
          {
            "source_type": "scripture",
            "reference": "NA28-2012:Rom.6.17-19",
            "text_quoted": "But God be thanked, that ye were the servants of sin... and being made free from sin, ye became the servants of righteousness",
            "original_language": "greek",
            "weight": "secondary"
          },
          {
            "source_type": "scripture",
            "reference": "NA28-2012:Jas.2.24",
            "text_quoted": "Ye see then how that by works a man is justified, and not by faith only",
            "original_language": "greek",
            "weight": "primary"
          }
        ],
        "counter_evidence": [
          {
            "source_type": "scripture",
            "reference": "NA28-2012:Rom.3.22-23",
            "text_quoted": "There is no difference, for all have sinned and fall short of the glory of God",
            "original_language": "greek",
            "weight": "secondary"
          },
          {
            "source_type": "historical",
            "reference": "Calvin-Inst-1559:3.11.2",
            "text_quoted": "justification consists in the forgiveness of sins and the imputation of the righteousness of Christ",
            "original_language": null,
            "weight": "secondary"
          }
        ],
        "profiles_in_scope": [
          "catholic-tridentine"
        ],
        "children": [],
        "notes": "Catholic position treats justification as a process that includes both declaration and transformation as integral aspects of God's gracious action."
      }
    ],
    "notes": "The fundamental divergence stems from different hermeneutical frameworks for handling apparent tensions between Pauline and Jacobite texts."
  },
  "profile_outcomes": [
    {
      "profile_id": "reformed-westminster",
      "outcome": "supports_claim",
      "node_id": "reformed-forensic-branch",
      "rationale_summary": "Reformed tradition affirms the forensic interpretation as primary, grounded in Calvin's Institutes and Westminster Confession, with Paul's language taking precedence in cases of apparent tension with James."
    },
    {
      "profile_id": "catholic-tridentine",
      "outcome": "rejects_claim",
      "node_id": "catholic-transformative-branch",
      "rationale_summary": "Catholic tradition rejects the purely forensic interpretation, following Trent's explicit teaching that justification includes both forgiveness and renewal, requiring harmonization of Paul and James."
    }
  ],
  "metrics": {
    "stability_score": 0.85,
    "depth_of_consensus": 1.0,
    "prior_dependence": [
      "authority_model",
      "interpretive_method",
      "clarity_hierarchy"
    ],
    "contestation_score": 0.75,
    "drift_score": 0.1,